PhraseId	Phrase	Expansion	Acronym
8599	The AR is a key element of our financial communication strategy.	Annual Report 	AR
8600	The AR provides valuable insight into our financial performance and objectives.	Annual Report 	AR
8601	The exchange rate for USD to CAD is favorable for travelers.	Canadian Dollar 	CAD 
8602	I'll need to convert my USD to CAD for the trip to Canada.	Canadian Dollar 	CAD 
8603	The CAD is the official currency of Canada.	Canadian Dollar 	CAD 
8604	I need to check the current CAD exchange rate.	Canadian Dollar 	CAD 
8605	The price of that item is 50 CAD.	Canadian Dollar 	CAD 
8606	I prefer using CAD for my purchases in Canada.	Canadian Dollar 	CAD 
8607	The CAD is a stable and reliable currency.	Canadian Dollar 	CAD 
8608	I exchanged my Euros for CAD at the airport.	Canadian Dollar 	CAD 
8609	The CAD has been performing well in the forex market.	Canadian Dollar 	CAD 
8610	The Canadian Dollar is often abbreviated as CAD.	Canadian Dollar 	CAD 
8611	The CAD is used alongside coins and banknotes.	Canadian Dollar 	CAD 
8612	I have a few CAD bills in my wallet.	Canadian Dollar 	CAD 
8613	The CAD coin features a maple leaf on it.	Canadian Dollar 	CAD 
8614	I always carry some CAD when traveling to Canada.	Canadian Dollar 	CAD 
8615	The CAD is commonly used for everyday transactions.	Canadian Dollar 	CAD 
8616	I'm planning to invest in CAD for my portfolio.	Canadian Dollar 	CAD 
8617	The exchange rate for GBP to CAD is quite high.	Canadian Dollar 	CAD 
8618	I can pay with CAD or credit card at the store.	Canadian Dollar 	CAD 
8619	The CAD is the official currency of the Great White North.	Canadian Dollar 	CAD 
8620	I received my change in CAD coins.	Canadian Dollar 	CAD 
8621	The Canadian Dollar is abbreviated as CAD in currency markets.	Canadian Dollar 	CAD 
8622	I need to find a currency exchange to get CAD.	Canadian Dollar 	CAD 
8623	The CAD is accepted at most businesses in Canada.	Canadian Dollar 	CAD 
8624	I have some CAD notes from my previous trip.	Canadian Dollar 	CAD 
8625	The CAD is widely used for international trade.	Canadian Dollar 	CAD 
8626	I checked the CAD exchange rate online.	Canadian Dollar 	CAD 
8627	The CAD is often referred to as the Loonie.	Canadian Dollar 	CAD 
8628	I'm looking to buy some CAD for my vacation.	Canadian Dollar 	CAD 
8629	The CAD banknotes come in various denominations.	Canadian Dollar 	CAD 
8630	I find the CAD to be a strong currency.	Canadian Dollar 	CAD 
8631	The CAD is represented by the symbol $.	Canadian Dollar 	CAD 
8632	I prefer to use CAD instead of my credit card.	Canadian Dollar 	CAD 
8633	The Canadian Dollar (CAD) is the national currency.	Canadian Dollar 	CAD 
8634	I have a few CAD coins in my pocket.	Canadian Dollar 	CAD 
8635	The CAD exchange rate is quite favorable.	Canadian Dollar 	CAD 
8636	I need to withdraw some CAD from the ATM.	Canadian Dollar 	CAD 
8637	The CAD is used by millions of Canadians daily.	Canadian Dollar 	CAD 
8638	I exchanged my US Dollars for CAD.	Canadian Dollar 	CAD 
8639	The CAD has a good reputation in the financial world.	Canadian Dollar 	CAD 
8640	I'll pay for this in CAD, please.	Canadian Dollar 	CAD 
8641	The CAD banknotes feature notable Canadians.	Canadian Dollar 	CAD 
8642	I always carry some CAD for emergencies.	Canadian Dollar 	CAD 
8643	The CAD is often used for international travel.	Canadian Dollar 	CAD 
8644	I checked the CAD to USD exchange rate.	Canadian Dollar 	CAD 
8645	The CAD is the official currency of Canada and its territories.	Canadian Dollar 	CAD 
8646	I have a CAD wallet for everyday expenses.	Canadian Dollar 	CAD 
8647	The CAD is one of the world's major currencies.	Canadian Dollar 	CAD 
8648	I'm thinking of investing in CAD for the long term.	Canadian Dollar 	CAD 
8649	The CAD exchange rate fluctuates daily.	Canadian Dollar 	CAD 
8650	I'll need to convert my Euros to CAD before my trip.	Canadian Dollar 	CAD 
8651	The CAD is known for its stability.	Canadian Dollar 	CAD 
8652	I received my change in CAD bills.	Canadian Dollar 	CAD 
8653	The CAD is commonly used in North America.	Canadian Dollar 	CAD 
8654	I always carry a mix of CAD coins and notes.	Canadian Dollar 	CAD 
8655	The CAD is often used for cross-border trade.	Canadian Dollar 	CAD 
8656	I checked the CAD to Euro exchange rate.	Canadian Dollar 	CAD 
8657	The CAD is a strong and reliable currency.	Canadian Dollar 	CAD 
8658	I prefer to have some CAD cash on hand.	Canadian Dollar 	CAD 
8659	The Canadian Dollar (CAD) is widely recognized.	Canadian Dollar 	CAD 
8660	I exchanged my Japanese Yen for CAD.	Canadian Dollar 	CAD 
8661	The CAD is commonly referred to as "buck."	Canadian Dollar 	CAD 
8662	I need to check the CAD to GBP exchange rate.	Canadian Dollar 	CAD 
8663	The CAD is used in various denominations.	Canadian Dollar 	CAD 
8664	I have a CAD piggy bank for saving spare change.	Canadian Dollar 	CAD 
8665	The CAD is the official currency of the second-largest country in the world.	Canadian Dollar 	CAD 
8666	I find the CAD to be a valuable currency.	Canadian Dollar 	CAD 
8667	The CAD is often used in online shopping.	Canadian Dollar 	CAD 
8668	I checked the CAD to Australian Dollar exchange rate.	Canadian Dollar 	CAD 
8669	The CAD is a common choice for tourists in Canada.	Canadian Dollar 	CAD 
8670	I have a few CAD coins in my coin jar.	Canadian Dollar 	CAD 
8671	The CAD is accepted at most tourist attractions.	Canadian Dollar 	CAD 
8672	I always have some CAD on me when visiting Canada.	Canadian Dollar 	CAD 
8673	The CAD is popular for its security features.	Canadian Dollar 	CAD 
8674	I exchanged my Chinese Yuan for CAD.	Canadian Dollar 	CAD 
8675	The CAD is a symbol of Canada's economy.	Canadian Dollar 	CAD 
8676	I need to find a CAD ATM for cash withdrawal.	Canadian Dollar 	CAD 
8677	The CAD is a reliable form of payment.	Canadian Dollar 	CAD 
8678	I checked the CAD to Indian Rupee exchange rate.	Canadian Dollar 	CAD 
8679	The CAD is used in government transactions.	Canadian Dollar 	CAD 
8680	I prefer to use CAD instead of credit cards.	Canadian Dollar 	CAD 
8681	The Canadian Dollar (CAD) is often used for international trade.	Canadian Dollar 	CAD 
8682	I have a few CAD banknotes in my wallet.	Canadian Dollar 	CAD 
8683	The CAD is accepted in most parts of Canada.	Canadian Dollar 	CAD 
8684	I always keep some CAD notes in my travel wallet.	Canadian Dollar 	CAD 
8685	The CAD is widely recognized in the financial world.	Canadian Dollar 	CAD 
8686	I checked the CAD to Mexican Peso exchange rate.	Canadian Dollar 	CAD 
8687	The CAD is used for everyday expenses.	Canadian Dollar 	CAD 
8688	I exchanged my British Pounds for CAD.	Canadian Dollar 	CAD 
8689	The CAD is a symbol of Canada's rich heritage.	Canadian Dollar 	CAD 
8690	I prefer to have some CAD cash for small purchases.	Canadian Dollar 	CAD 
8691	The Canadian Dollar (CAD) is a world-renowned currency.	Canadian Dollar 	CAD 
8692	I need to find a CAD currency converter for accurate rates.	Canadian Dollar 	CAD 
8693	The CAD is often used for cross-border shopping.	Canadian Dollar 	CAD 
8694	I have a CAD savings account for future goals.	Canadian Dollar 	CAD 
8695	The CAD is known for its durability.	Canadian Dollar 	CAD 
8696	I checked the CAD to Swiss Franc exchange rate.	Canadian Dollar 	CAD 
8697	The CAD is accepted at many Canadian restaurants.	Canadian Dollar 	CAD 
8698	I always carry some CAD for dining out.	Canadian Dollar 	CAD 
8699	The CAD is a preferred choice for tourists.	Canadian Dollar 	CAD 
8700	I exchanged my Australian Dollars for CAD.	Canadian Dollar 	CAD 
8701	The CAD is used in various financial transactions.	Canadian Dollar 	CAD 
8702	I prefer to use CAD for online shopping.	Canadian Dollar 	CAD 
8703	The Canadian Dollar (CAD) is widely circulated.	Canadian Dollar 	CAD 
8704	I have a few CAD coins in my car's console.	Canadian Dollar 	CAD 
8705	The CAD is a common choice for tourists in the Great White North.	Canadian Dollar 	CAD 
8706	I need to check the CAD to Chinese Yuan exchange rate.	Canadian Dollar 	CAD 
8707	The CAD is often used for souvenir shopping.	Canadian Dollar 	CAD 
8708	I always carry some CAD for buying gifts.	Canadian Dollar 	CAD 
8709	The CAD is popular for its unique security features.	Canadian Dollar 	CAD 
8710	I exchanged my Indian Rupees for CAD.	Canadian Dollar 	CAD 
8711	The CAD is a symbol of Canada's cultural diversity.	Canadian Dollar 	CAD 
8712	I prefer to have some CAD cash for local markets.	Canadian Dollar 	CAD 
8713	The Canadian Dollar (CAD) is a versatile currency.	Canadian Dollar 	CAD 
8714	I checked the CAD to Japanese Yen exchange rate.	Canadian Dollar 	CAD 
8715	The CAD is used for various forms of entertainment.	Canadian Dollar 	CAD 
8716	I have a CAD change jar for collecting coins.	Canadian Dollar 	CAD 
8717	The CAD is known for its distinctive appearance.	Canadian Dollar 	CAD 
8718	I need to find a CAD ATM for easy access to cash.	Canadian Dollar 	CAD 
8719	The CAD is a reliable choice for everyday purchases.	Canadian Dollar 	CAD 
8720	I always keep some CAD notes in my travel wallet.	Canadian Dollar 	CAD 
8721	The CAD is often used in Canadian retail stores.	Canadian Dollar 	CAD 
8722	I exchanged my Mexican Pesos for CAD.	Canadian Dollar 	CAD 
8723	The CAD is a reflection of Canada's natural beauty.	Canadian Dollar 	CAD 
8724	I prefer to use CAD for quick and hassle-free transactions.	Canadian Dollar 	CAD 
8725	The Canadian Dollar (CAD) is a valuable asset.	Canadian Dollar 	CAD 
8726	I checked the CAD to Swiss Franc exchange rate.	Canadian Dollar 	CAD 
8727	The CAD is accepted at most Canadian gas stations.	Canadian Dollar 	CAD 
8728	I always carry some CAD for filling up the tank.	Canadian Dollar 	CAD 
8729	The CAD is popular for its unique design elements.	Canadian Dollar 	CAD 
8730	I exchanged my Euros for CAD before my trip to Canada.	Canadian Dollar 	CAD 
8731	The CAD is a symbol of Canada's wildlife.	Canadian Dollar 	CAD 
8732	I need to check the CAD to Australian Dollar exchange rate.	Canadian Dollar 	CAD 
8733	The CAD is often used for camping and outdoor activities.	Canadian Dollar 	CAD 
8734	I always have some CAD on hand for emergencies.	Canadian Dollar 	CAD 
8735	The CAD is recognized for its portrayal of Canadian history.	Canadian Dollar 	CAD 
8736	I exchanged my US Dollars for CAD at the airport.	Canadian Dollar 	CAD 
8737	The CAD is accepted at national parks across Canada.	Canadian Dollar 	CAD 
8738	I prefer to use CAD for entrance fees and park permits.	Canadian Dollar 	CAD 
8739	The Canadian Dollar (CAD) is the currency of choice for many tourists.	Canadian Dollar 	CAD 
8740	I checked the CAD to Indian Rupee exchange rate before my trip.	Canadian Dollar 	CAD 
8741	The CAD is used for accommodations and hotel expenses.	Canadian Dollar 	CAD 
8742	I have a CAD wallet for managing my travel budget.	Canadian Dollar 	CAD 
8743	The CAD is often used for guided tours and excursions.	Canadian Dollar 	CAD 
8744	I exchanged my Japanese Yen for CAD at the currency exchange.	Canadian Dollar 	CAD 
8745	The CAD is accepted at various museums and cultural institutions.	Canadian Dollar 	CAD 
8746	I always keep some CAD notes for museum admissions.	Canadian Dollar 	CAD 
8747	The CAD is a preferred choice for dining out at Canadian restaurants.	Canadian Dollar 	CAD 
8748	I need to check the CAD to British Pound exchange rate for my trip.	Canadian Dollar 	CAD 
8749	The CAD is used for restaurant bills and tipping.	Canadian Dollar 	CAD 
8750	I prefer to use CAD for culinary experiences and fine dining.	Canadian Dollar 	CAD 
8751	The Canadian Dollar (CAD) is the currency of choice for foodies.	Canadian Dollar 	CAD 
8752	I checked the CAD to Mexican Peso exchange rate for my vacation.	Canadian Dollar 	CAD 
8753	The CAD is often used for exploring local cuisine.	Canadian Dollar 	CAD 
8754	I always carry some CAD for trying Canadian dishes.	Canadian Dollar 	CAD 
8755	The CAD is popular for its versatility in culinary adventures.	Canadian Dollar 	CAD 
8756	I exchanged my Euros for CAD to enjoy Canadian cuisine.	Canadian Dollar 	CAD 
8757	The CAD is accepted at most Canadian bars and pubs.	Canadian Dollar 	CAD 
8758	I prefer to use CAD for ordering drinks and socializing.	Canadian Dollar 	CAD 
8759	The Canadian Dollar (CAD) is the preferred currency for nightlife.	Canadian Dollar 	CAD 
8760	I checked the CAD to Swiss Franc exchange rate before my trip.	Canadian Dollar 	CAD 
8761	The CAD is used for experiencing the vibrant nightlife in Canada.	Canadian Dollar 	CAD 
8762	I have a CAD wallet for going out with friends.	Canadian Dollar 	CAD 
8763	The CAD is often used for attending concerts and shows.	Canadian Dollar 	CAD 
8764	I exchanged my US Dollars for CAD to enjoy live music.	Canadian Dollar 	CAD 
8765	The CAD is accepted at various entertainment venues.	Canadian Dollar 	CAD 
8766	I always keep some CAD notes for concert tickets.	Canadian Dollar 	CAD 
8767	The CAD is a popular choice for attending sports events in Canada.	Canadian Dollar 	CAD 
8768	I need to check the CAD to Indian Rupee exchange rate for my trip.	Canadian Dollar 	CAD 
8769	The CAD is used for buying tickets to games and matches.	Canadian Dollar 	CAD 
8770	I prefer to use CAD for cheering on my favorite teams.	Canadian Dollar 	CAD 
8771	The Canadian Dollar (CAD) is the currency of choice for sports fans.	Canadian Dollar 	CAD 
8772	I checked the CAD to Australian Dollar exchange rate for my vacation.	Canadian Dollar 	CAD 
8773	The CAD is often used for outdoor activities and adventure sports.	Canadian Dollar 	CAD 
8774	I always carry some CAD for participating in sports and recreation.	Canadian Dollar 	CAD 
8775	The CAD is recognized for its contribution to the sports industry.	Canadian Dollar 	CAD 
8776	I exchanged my Japanese Yen for CAD to explore outdoor adventures.	Canadian Dollar 	CAD 
8777	The CAD is accepted at various outdoor rental shops.	Canadian Dollar 	CAD 
8778	I prefer to use CAD for renting equipment and gear.	Canadian Dollar 	CAD 
8779	The Canadian Dollar (CAD) is the currency of choice for adventurers.	Canadian Dollar 	CAD 
8780	I checked the CAD to Chinese Yuan exchange rate for my trip.	Canadian Dollar 	CAD 
8781	The CAD is often used for experiencing thrilling activities.	Canadian Dollar 	CAD 
8782	I have a CAD wallet for my adrenaline-pumping adventures.	Canadian Dollar 	CAD 
8783	The CAD is used for paying for guided tours and outdoor excursions.	Canadian Dollar 	CAD 
8784	I exchanged my British Pounds for CAD for my adventure vacation.	Canadian Dollar 	CAD 
8785	The CAD is accepted at most adventure tour companies.	Canadian Dollar 	CAD 
8786	I prefer to use CAD for my action-packed vacations.	Canadian Dollar 	CAD 
8787	The Canadian Dollar (CAD) is the currency of choice for thrill-seekers.	Canadian Dollar 	CAD 
8788	I checked the CAD to Mexican Peso exchange rate for my trip.	Canadian Dollar 	CAD 
8789	The CAD is often used for exploring natural wonders and landmarks.	Canadian Dollar 	CAD 
8790	I always carry some CAD for sightseeing and exploring.	Canadian Dollar 	CAD 
8791	The CAD is recognized for its contribution to tourism.	Canadian Dollar 	CAD 
8792	I exchanged my US Dollars for CAD for my sightseeing trip.	Canadian Dollar 	CAD 
8793	The CAD is accepted at various tourist attractions and landmarks.	Canadian Dollar 	CAD 
8794	I prefer to use CAD for entrance fees to museums and parks.	Canadian Dollar 	CAD 
8795	The Canadian Dollar (CAD) is the currency of choice for tourists.	Canadian Dollar 	CAD 
8796	I checked the CAD to Swiss Franc exchange rate for my trip.	Canadian Dollar 	CAD 
8797	The CAD is often used for experiencing the local culture and heritage.	Canadian Dollar 	CAD 
8798	I have a CAD wallet for my cultural explorations.	Canadian Dollar 	CAD 
8799	The CAD is used for paying for guided city tours and cultural experiences.	Canadian Dollar 	CAD 
8800	I exchanged my Euros for CAD to immerse myself in the local culture.	Canadian Dollar 	CAD 
8801	CAD software has revolutionized the field of architecture.	computer-aided design 	CAD 
8802	Engineers use CAD to create precise technical drawings.	computer-aided design 	CAD 
8803	CAD technology simplifies the product design process.	computer-aided design 	CAD 
8804	CAD tools are essential for 3D modeling.	computer-aided design 	CAD 
8805	CAD allows for efficient drafting and documentation.	computer-aided design 	CAD 
8806	The CAD system enhances collaboration in design projects.	computer-aided design 	CAD 
8807	CAD software is a valuable asset for mechanical engineers.	computer-aided design 	CAD 
8808	CAD programs enable architects to visualize complex structures.	computer-aided design 	CAD 
8809	CAD design is crucial in the automotive industry.	computer-aided design 	CAD 
8810	CAD modeling streamlines the prototyping process.	computer-aided design 	CAD 
8811	CAD software offers advanced parametric modeling features.	computer-aided design 	CAD 
8812	CAD professionals create intricate 2D and 3D designs.	computer-aided design 	CAD 
8813	CAD drawings are the foundation of modern construction projects.	computer-aided design 	CAD 
8814	CAD drafting ensures accuracy in building plans.	computer-aided design 	CAD 
8815	CAD plays a key role in industrial design.	computer-aided design 	CAD 
8816	CAD programs facilitate the creation of blueprints.	computer-aided design 	CAD 
8817	CAD technology is integral to the aerospace industry.	computer-aided design 	CAD 
8818	CAD software is used in the development of electronic devices.	computer-aided design 	CAD 
8819	CAD modeling allows for rapid design iterations.	computer-aided design 	CAD 
8820	CAD design minimizes errors in product development.	computer-aided design 	CAD 
8821	Architects use CAD tools to design sustainable buildings.	computer-aided design 	CAD 
8822	CAD drafting enhances precision in manufacturing.	computer-aided design 	CAD 
8823	CAD helps visualize architectural concepts.	computer-aided design 	CAD 
8824	CAD software simplifies the creation of digital prototypes.	computer-aided design 	CAD 
8825	Engineers rely on CAD for finite element analysis.	computer-aided design 	CAD 
8826	CAD modeling supports the creation of complex geometries.	computer-aided design 	CAD 
8827	CAD technology aids in the optimization of structural designs.	computer-aided design 	CAD 
8828	CAD programs improve the efficiency of design workflows.	computer-aided design 	CAD 
8829	CAD design is crucial for urban planning.	computer-aided design 	CAD 
8830	CAD drafting ensures accurate site plans.	computer-aided design 	CAD 
8831	CAD plays a key role in the automotive design process.	computer-aided design 	CAD 
8832	CAD software enhances the creation of consumer electronics.	computer-aided design 	CAD 
8833	CAD modeling is essential in the fashion industry.	computer-aided design 	CAD 
8834	CAD tools are used in the design of medical devices.	computer-aided design 	CAD 
8835	CAD drawings are a vital part of civil engineering projects.	computer-aided design 	CAD 
8836	CAD drafting enables precise electrical schematics.	computer-aided design 	CAD 
8837	CAD technology is indispensable in the defense industry.	computer-aided design 	CAD 
8838	CAD software is used in the development of renewable energy systems.	computer-aided design 	CAD 
8839	CAD design simplifies the creation of custom furniture.	computer-aided design 	CAD 
8840	CAD modeling supports the creation of intricate jewelry.	computer-aided design 	CAD 
8841	CAD programs help in the design of intricate machinery.	computer-aided design 	CAD 
8842	CAD technology is integral to the video game industry.	computer-aided design 	CAD 
8843	CAD plays a key role in the creation of architectural renderings.	computer-aided design 	CAD 
8844	CAD software enhances the design of consumer products.	computer-aided design 	CAD 
8845	Engineers rely on CAD for stress analysis.	computer-aided design 	CAD 
8846	CAD drafting ensures accuracy in circuit board design.	computer-aided design 	CAD 
8847	CAD tools are used in the design of urban infrastructure.	computer-aided design 	CAD 
8848	CAD drawings are vital for the development of transportation systems.	computer-aided design 	CAD 
8849	CAD modeling supports the creation of ergonomic products.	computer-aided design 	CAD 
8850	CAD technology aids in the design of medical implants.	computer-aided design 	CAD 
8851	CAD programs simplify the creation of intricate 3D-printed objects.	computer-aided design 	CAD 
8852	CAD design is crucial for the creation of artistic sculptures.	computer-aided design 	CAD 
8853	CAD software streamlines the design of educational materials.	computer-aided design 	CAD 
8854	CAD technology enhances the creation of digital artwork.	computer-aided design 	CAD 
8855	CAD modeling is used in the fashion industry for clothing design.	computer-aided design 	CAD 
8856	CAD tools support the design of interior spaces.	computer-aided design 	CAD 
8857	CAD drafting ensures precision in ship design.	computer-aided design 	CAD 
8858	CAD plays a key role in the creation of detailed maps.	computer-aided design 	CAD 
8859	CAD software is used in the development of innovative consumer gadgets.	computer-aided design 	CAD 
8860	Engineers rely on CAD for thermal analysis.	computer-aided design 	CAD 
8861	CAD technology is indispensable in the development of mobile apps.	computer-aided design 	CAD 
8862	CAD design simplifies the creation of intricate graphics.	computer-aided design 	CAD 
8863	CAD programs are essential for the design of website interfaces.	computer-aided design 	CAD 
8864	CAD modeling supports the creation of intricate user interfaces.	computer-aided design 	CAD 
8865	CAD drawings are vital for the development of interactive software.	computer-aided design 	CAD 
8866	CAD drafting ensures precision in the design of video games.	computer-aided design 	CAD 
8867	CAD tools enhance the creation of virtual reality experiences.	computer-aided design 	CAD 
8868	CAD technology is integral to the development of augmented reality applications.	computer-aided design 	CAD 
8869	CAD software streamlines the creation of interactive simulations.	computer-aided design 	CAD 
8870	Engineers rely on CAD for the design of advanced automation systems.	computer-aided design 	CAD 
8871	CAD modeling is crucial in the field of robotics.	computer-aided design 	CAD 
8872	CAD design is essential for the development of autonomous vehicles.	computer-aided design 	CAD 
8873	CAD programs support the design of advanced artificial intelligence algorithms.	computer-aided design 	CAD 
8874	CAD technology aids in the creation of machine learning models.	computer-aided design 	CAD 
8875	CAD plays a key role in the development of smart cities.	computer-aided design 	CAD 
8876	CAD software is used in the design of Internet of Things (IoT) devices.	computer-aided design 	CAD 
8877	CAD drafting ensures precision in the development of blockchain technology.	computer-aided design 	CAD 
8878	CAD tools are vital for the creation of cybersecurity solutions.	computer-aided design 	CAD 
8879	CAD drawings support the design of advanced data analytics platforms.	computer-aided design 	CAD 
8880	CAD modeling is integral to the development of quantum computing.	computer-aided design 	CAD 
8881	CAD technology streamlines the creation of biotechnology solutions.	computer-aided design 	CAD 
8882	CAD programs are essential for the design of space exploration technologies.	computer-aided design 	CAD 
8883	CAD design plays a crucial role in the advancement of nanotechnology.	computer-aided design 	CAD 
8884	CAD software is used in the development of clean energy solutions.	computer-aided design 	CAD 
8885	Engineers rely on CAD for the design of sustainable transportation systems.	computer-aided design 	CAD 
8886	CAD modeling supports the creation of advanced environmental monitoring tools.	computer-aided design 	CAD 
8887	CAD drafting ensures precision in the design of eco-friendly architecture.	computer-aided design 	CAD 
8888	CAD tools are used in the development of green infrastructure projects.	computer-aided design 	CAD 
8889	CAD technology is indispensable in the field of climate change mitigation.	computer-aided design 	CAD 
8890	CAD software streamlines the design of renewable energy solutions.	computer-aided design 	CAD 
8891	CAD design is essential for the development of sustainable agriculture.	computer-aided design 	CAD 
8892	CAD programs support the design of environmentally friendly urban planning.	computer-aided design 	CAD 
8893	CAD modeling aids in the creation of advanced waste management systems.	computer-aided design 	CAD 
8894	CAD drawings are vital for the development of clean water technologies.	computer-aided design 	CAD 
8895	CAD drafting ensures precision in the design of ecological conservation initiatives.	computer-aided design 	CAD 
8896	CAD tools enhance the creation of wildlife protection strategies.	computer-aided design 	CAD 
8897	CAD technology is integral to the development of biodiversity preservation efforts.	computer-aided design 	CAD 
8898	CAD software is used in the design of national park management solutions.	computer-aided design 	CAD 
8899	Engineers rely on CAD for the design of sustainable forestry practices.	computer-aided design 	CAD 
8900	CAD modeling supports the creation of climate change adaptation strategies.	computer-aided design 	CAD 
8901	CAD plays a key role in the advancement of sustainable fishing practices.	computer-aided design 	CAD 
8902	CAD software is used in the development of eco-friendly energy generation.	computer-aided design 	CAD 
