PhraseId	Phrase	Expansion	Acronym
5546	MBO transactions evaluate financial stability.	Management BuyOut	MBO
5547	Management BuyOuts align product development.	Management BuyOut	MBO
5548	MBO deals assess market entry strategies.	Management BuyOut	MBO
5549	The MBO process involves financial analysis.	Management BuyOut	MBO
5550	MBOs streamline supply chain operations.	Management BuyOut	MBO
5551	Successful MBOs identify strategic partnerships.	Management BuyOut	MBO
5552	MBO transactions involve industry benchmarks.	Management BuyOut	MBO
5553	Management BuyOuts assess market potential.	Management BuyOut	MBO
5554	MBO deals optimize financial performance.	Management BuyOut	MBO
5555	The MBO process considers stakeholder communication.	Management BuyOut	MBO
5556	MBOs evaluate industry consolidation.	Management BuyOut	MBO
5557	Successful MBOs involve asset valuation.	Management BuyOut	MBO
5558	MBO transactions impact organizational structure.	Management BuyOut	MBO
5559	Management BuyOuts consider cultural integration.	Management BuyOut	MBO
5560	MBOs analyze merger implications.	Management BuyOut	MBO
5561	The MBO team assesses growth strategies.	Management BuyOut	MBO
5562	MBO transactions streamline operations.	Management BuyOut	MBO
5563	Successful MBOs optimize brand positioning.	Management BuyOut	MBO
5564	MBOs explore international expansion.	Management BuyOut	MBO
5565	The MBO process evaluates financial stability.	Management BuyOut	MBO
5566	MBO deals impact market competition.	Management BuyOut	MBO
5567	Management BuyOuts involve regulatory compliance.	Management BuyOut	MBO
5568	MBO transactions assess technology infrastructure.	Management BuyOut	MBO
5569	Successful MBOs optimize financial performance.	Management BuyOut	MBO
5570	MBOs focus on stakeholder communication.	Management BuyOut	MBO
5571	The MBO process evaluates industry consolidation.	Management BuyOut	MBO
5572	MBO transactions involve asset valuation.	Management BuyOut	MBO
5573	Successful MBOs impact organizational structure.	Management BuyOut	MBO
5574	MBOs consider workforce alignment.	Management BuyOut	MBO
5575	MBO transactions require stakeholder engagement.	Management BuyOut	MBO
5576	Successful MBOs optimize supply chain management.	Management BuyOut	MBO
5577	MBOs focus on post-merger success.	Management BuyOut	MBO
5578	The MBO process involves market analysis.	Management BuyOut	MBO
5579	MBO deals impact industry positioning.	Management BuyOut	MBO
5580	MBOs assess customer loyalty.	Management BuyOut	MBO
5581	Successful MBOs secure financing arrangements.	Management BuyOut	MBO
5582	MBO transactions address merger execution.	Management BuyOut	MBO
5583	MBO experts analyze market conditions.	Management BuyOut	MBO
5584	MBO transactions evaluate competitive landscapes.	Management BuyOut	MBO
5585	MBOs involve technology integration.	Management BuyOut	MBO
5586	Successful MBOs optimize merger synergies.	Management BuyOut	MBO
5587	MBOs consider regulatory compliance.	Management BuyOut	MBO
5588	MBO transactions assess market opportunities.	Management BuyOut	MBO
5589	MBO deals impact supply chain efficiency.	Management BuyOut	MBO
5590	MBOs align merger objectives.	Management BuyOut	MBO
5591	The MBO process explores market expansion opportunities.	Management BuyOut	MBO
5592	MBOs assess target company potential.	Management BuyOut	MBO
5593	Successful MBOs impact industry consolidation.	Management BuyOut	MBO
5594	MBO transactions involve regulatory assessments.	Management BuyOut	MBO
5595	MBO negotiations determine merger terms and conditions.	Management BuyOut	MBO
5596	Successful MBOs evaluate financial performance metrics.	Management BuyOut	MBO
5597	MBO experts analyze market demand.	Management BuyOut	MBO
5598	MBO transactions assess customer portfolios.	Management BuyOut	MBO
5599	Successful MBOs streamline business processes.	Management BuyOut	MBO
5600	MBOs optimize operational synergy.	Management BuyOut	MBO
5601	Management By Objectives is a goal-setting framework.	Management By Objectives	MBO
5602	MBO emphasizes clear performance targets.	Management By Objectives	MBO
5603	The MBO process involves employee collaboration.	Management By Objectives	MBO
5604	MBO helps align individual goals with company objectives.	Management By Objectives	MBO
5605	Managers and employees discuss MBO objectives.	Management By Objectives	MBO
5606	Management By Objectives enhances employee motivation.	Management By Objectives	MBO
5607	MBO focuses on measurable outcomes.	Management By Objectives	MBO
5608	MBO promotes regular performance reviews.	Management By Objectives	MBO
5609	MBO goals should be specific and achievable.	Management By Objectives	MBO
5610	The MBO process requires effective communication.	Management By Objectives	MBO
5611	MBO enhances organizational performance.	Management By Objectives	MBO
5612	Management By Objectives encourages employee development.	Management By Objectives	MBO
5613	MBO emphasizes employee participation.	Management By Objectives	MBO
5614	MBO objectives are set at the beginning of a period.	Management By Objectives	MBO
5615	MBO fosters a results-oriented culture.	Management By Objectives	MBO
5616	MBO requires regular progress monitoring.	Management By Objectives	MBO
5617	Management By Objectives improves goal clarity.	Management By Objectives	MBO
5618	MBO aligns individual efforts with company strategy.	Management By Objectives	MBO
5619	MBO objectives should be realistic and relevant.	Management By Objectives	MBO
5620	The MBO process enhances accountability.	Management By Objectives	MBO
5621	MBO promotes employee engagement.	Management By Objectives	MBO
5622	MBO outcomes are tied to organizational success.	Management By Objectives	MBO
5623	MBO goals should be time-bound.	Management By Objectives	MBO
5624	MBO encourages continuous feedback.	Management By Objectives	MBO
5625	Management By Objectives supports career development.	Management By Objectives	MBO
5626	MBO drives performance improvement.	Management By Objectives	MBO
5627	MBO objectives are aligned with company values.	Management By Objectives	MBO
5628	MBO enhances decision-making.	Management By Objectives	MBO
5629	MBO results are linked to compensation.	Management By Objectives	MBO
5630	The MBO process measures goal achievement.	Management By Objectives	MBO
5631	MBO promotes employee empowerment.	Management By Objectives	MBO
5632	MBO goals are tailored to individual roles.	Management By Objectives	MBO
5633	MBO requires regular goal updates.	Management By Objectives	MBO
5634	Management By Objectives fosters collaboration.	Management By Objectives	MBO
5635	MBO supports employee recognition.	Management By Objectives	MBO
5636	MBO goals should be challenging but attainable.	Management By Objectives	MBO
5637	MBO enhances employee satisfaction.	Management By Objectives	MBO
5638	MBO promotes individual and team success.	Management By Objectives	MBO
5639	The MBO process evaluates goal attainment.	Management By Objectives	MBO
5640	MBO encourages employee innovation.	Management By Objectives	MBO
5641	MBO objectives are customized for each employee.	Management By Objectives	MBO
5642	MBO aligns personal and company objectives.	Management By Objectives	MBO
5643	MBO drives organizational performance.	Management By Objectives	MBO
5644	MBO goals should be clear and concise.	Management By Objectives	MBO
5645	MBO supports employee growth.	Management By Objectives	MBO
5646	Management By Objectives tracks progress.	Management By Objectives	MBO
5647	MBO outcomes are tied to performance evaluations.	Management By Objectives	MBO
5648	MBO fosters a goal-driven workplace.	Management By Objectives	MBO
5649	The MBO process measures individual contributions.	Management By Objectives	MBO
5650	MBO promotes goal ownership.	Management By Objectives	MBO
5651	MBO objectives are reviewed regularly.	Management By Objectives	MBO
5652	MBO improves employee communication.	Management By Objectives	MBO
5653	MBO enhances goal achievement.	Management By Objectives	MBO
5654	MBO goals should be meaningful.	Management By Objectives	MBO
5655	MBO encourages self-assessment.	Management By Objectives	MBO
5656	Management By Objectives links rewards to results.	Management By Objectives	MBO
5657	MBO aligns teams with strategic priorities.	Management By Objectives	MBO
5658	MBO requires objective setting at all levels.	Management By Objectives	MBO
5659	The MBO process enhances employee development.	Management By Objectives	MBO
5660	MBO supports a performance-based culture.	Management By Objectives	MBO
5661	MBO outcomes are tied to bonuses.	Management By Objectives	MBO
5662	MBO drives organizational success.	Management By Objectives	MBO
5663	MBO objectives are tailored to job roles.	Management By Objectives	MBO
5664	MBO promotes employee goal commitment.	Management By Objectives	MBO
5665	MBO goals should be aligned with company goals.	Management By Objectives	MBO
5666	MBO fosters continuous improvement.	Management By Objectives	MBO
5667	Management By Objectives measures employee contributions.	Management By Objectives	MBO
5668	MBO enhances performance evaluation.	Management By Objectives	MBO
5669	MBO objectives are cascaded throughout the organization.	Management By Objectives	MBO
5670	MBO improves employee engagement.	Management By Objectives	MBO
5671	The MBO process drives goal attainment.	Management By Objectives	MBO
5672	MBO supports employee skill development.	Management By Objectives	MBO
5673	MBO goals are achievable with effort.	Management By Objectives	MBO
5674	MBO promotes goal clarity.	Management By Objectives	MBO
5675	MBO encourages goal alignment.	Management By Objectives	MBO
5676	MBO outcomes are tied to promotions.	Management By Objectives	MBO
5677	Management By Objectives boosts employee morale.	Management By Objectives	MBO
5678	MBO enhances performance feedback.	Management By Objectives	MBO
5679	MBO objectives are evaluated objectively.	Management By Objectives	MBO
5680	MBO drives individual and team success.	Management By Objectives	MBO
5681	The MBO process links compensation to objectives.	Management By Objectives	MBO
5682	MBO supports employee career growth.	Management By Objectives	MBO
5683	MBO goals should be results-oriented.	Management By Objectives	MBO
5684	MBO fosters a culture of accountability.	Management By Objectives	MBO
5685	MBO measures progress toward goals.	Management By Objectives	MBO
5686	Management By Objectives motivates employees.	Management By Objectives	MBO
5687	MBO outcomes are linked to recognition.	Management By Objectives	MBO
5688	MBO aligns personal development with company needs.	Management By Objectives	MBO
5689	MBO improves employee job satisfaction.	Management By Objectives	MBO
5690	The MBO process sets clear expectations.	Management By Objectives	MBO
5691	MBO enhances employee goal setting.	Management By Objectives	MBO
5692	MBO objectives are reviewed and adjusted.	Management By Objectives	MBO
5693	MBO drives performance excellence.	Management By Objectives	MBO
5694	MBO goals should be SMART (Specific, Measurable, Achievable, Relevant, Time-bound).	Management By Objectives	MBO
5695	MBO supports talent development.	Management By Objectives	MBO
5696	MBO promotes teamwork.	Management By Objectives	MBO
5697	MBO outcomes are tied to job performance.	Management By Objectives	MBO
5698	Management By Objectives enhances leadership.	Management By Objectives	MBO
5699	MBO improves organizational alignment.	Management By Objectives	MBO
5700	MBO objectives empower employees.	Management By Objectives	MBO
5701	The MBO process encourages self-assessment.	Management By Objectives	MBO
5702	MBO drives goal achievement.	Management By Objectives	MBO
5703	MBO goals should be communicated effectively.	Management By Objectives	MBO
5704	MBO fosters goal ownership.	Management By Objectives	MBO
5705	MBO measures individual and team contributions.	Management By Objectives	MBO
5706	MBO supports employee recognition programs.	Management By Objectives	MBO
5707	MBO aligns team objectives with company strategy.	Management By Objectives	MBO
5708	MBO enhances employee commitment.	Management By Objectives	MBO
5709	MBO outcomes are tied to career growth.	Management By Objectives	MBO
5710	Management By Objectives strengthens performance management.	Management By Objectives	MBO
5711	MBO objectives drive employee engagement.	Management By Objectives	MBO
5712	MBO goals are tracked and evaluated.	Management By Objectives	MBO
5713	MBO promotes a culture of continuous improvement.	Management By Objectives	MBO
5714	MBO requires regular goal setting.	Management By Objectives	MBO
5715	The MBO process supports employee development plans.	Management By Objectives	MBO
5716	MBO improves communication across the organization.	Management By Objectives	MBO
5717	MBO encourages goal alignment at all levels.	Management By Objectives	MBO
5718	MBO outcomes are linked to skill development.	Management By Objectives	MBO
5719	MBO enhances organizational agility.	Management By Objectives	MBO
5720	Management By Objectives measures individual progress.	Management By Objectives	MBO
5721	MBO drives employee accountability.	Management By Objectives	MBO
5722	MBO goals should be ambitious yet realistic.	Management By Objectives	MBO
5723	MBO supports personal growth.	Management By Objectives	MBO
5724	MBO fosters a collaborative workplace.	Management By Objectives	MBO
5725	MBO objectives enhance performance reviews.	Management By Objectives	MBO
5726	MBO aligns employee objectives with company goals.	Management By Objectives	MBO
5727	MBO outcomes are tied to compensation packages.	Management By Objectives	MBO
5728	MBO drives career advancement.	Management By Objectives	MBO
5729	Management By Objectives empowers employees.	Management By Objectives	MBO
5730	MBO improves workforce productivity.	Management By Objectives	MBO
5731	MBO goals should be transparent.	Management By Objectives	MBO
5732	MBO promotes goal commitment.	Management By Objectives	MBO
5733	MBO measures employee contributions objectively.	Management By Objectives	MBO
5734	MBO supports organizational effectiveness.	Management By Objectives	MBO
5735	MBO objectives encourage employee self-assessment.	Management By Objectives	MBO
5736	MBO enhances team performance.	Management By Objectives	MBO
5737	MBO outcomes are tied to employee development.	Management By Objectives	MBO
5738	Management By Objectives strengthens leadership skills.	Management By Objectives	MBO
5739	MBO aligns personal and professional growth.	Management By Objectives	MBO
5740	MBO drives workplace innovation.	Management By Objectives	MBO
5741	MBO goals should be aligned with company values.	Management By Objectives	MBO
5742	MBO fosters a culture of recognition.	Management By Objectives	MBO
5743	MBO objectives are linked to bonuses and rewards.	Management By Objectives	MBO
5744	MBO enhances individual and team effectiveness.	Management By Objectives	MBO
5745	MBO supports employee career planning.	Management By Objectives	MBO
5746	MBO outcomes are tied to organizational excellence.	Management By Objectives	MBO
5747	Management By Objectives improves goal tracking.	Management By Objectives	MBO
5748	MBO drives performance improvement initiatives.	Management By Objectives	MBO
5749	MBO goals should be well-defined.	Management By Objectives	MBO
5750	MBO promotes goal ownership and accountability.	Management By Objectives	MBO
5751	MBO measures performance objectively.	Management By Objectives	MBO
5752	MBO supports employee skill development.	Management By Objectives	MBO
5753	MBO objectives enhance leadership development.	Management By Objectives	MBO
5754	MBO fosters a culture of continuous learning.	Management By Objectives	MBO
5755	MBO aligns individual and team objectives.	Management By Objectives	MBO
5756	MBO outcomes are linked to employee engagement.	Management By Objectives	MBO
5757	Management By Objectives empowers employees to set their own goals.	Management By Objectives	MBO
5758	MBO improves communication and collaboration.	Management By Objectives	MBO
5759	MBO goals should be aligned with strategic priorities.	Management By Objectives	MBO
5760	MBO promotes goal alignment with company values.	Management By Objectives	MBO
5761	MBO measures progress toward individual and team goals.	Management By Objectives	MBO
5762	MBO supports professional development.	Management By Objectives	MBO
5763	MBO objectives are tied to career advancement opportunities.	Management By Objectives	MBO
5764	MBO enhances employee retention and satisfaction.	Management By Objectives	MBO
5765	MBO drives organizational success and growth.	Management By Objectives	MBO
5766	MBO goals should be relevant to job roles.	Management By Objectives	MBO
5767	MBO fosters a culture of innovation and creativity.	Management By Objectives	MBO
5768	MBO improves organizational agility and adaptability.	Management By Objectives	MBO
5769	MBO aligns individual goals with departmental and company objectives.	Management By Objectives	MBO
5770	MBO outcomes are tied to performance evaluations and rewards.	Management By Objectives	MBO
5771	Management By Objectives strengthens leadership and management capabilities.	Management By Objectives	MBO
5772	MBO supports employee engagement and motivation.	Management By Objectives	MBO
5773	MBO objectives drive continuous improvement efforts.	Management By Objectives	MBO
5774	MBO enhances team collaboration and performance.	Management By Objectives	MBO
5775	MBO goals should be challenging yet attainable.	Management By Objectives	MBO
5776	MBO promotes a culture of excellence and high performance.	Management By Objectives	MBO
5777	MBO measures goal attainment and progress.	Management By Objectives	MBO
5778	MBO supports employee training and development initiatives.	Management By Objectives	MBO
5779	MBO fosters a sense of ownership and responsibility.	Management By Objectives	MBO
5780	MBO aligns personal development with company goals and strategy.	Management By Objectives	MBO
5781	MBO outcomes are linked to employee recognition and appreciation.	Management By Objectives	MBO
5782	Management By Objectives empowers employees to take control of their own career development.	Management By Objectives	MBO
5783	MBO improves communication and transparency within the organization.	Management By Objectives	MBO
5784	MBO goals should be specific and measurable.	Management By Objectives	MBO
5785	MBO promotes goal commitment and dedication.	Management By Objectives	MBO
5786	MBO measures individual and team contributions to success.	Management By Objectives	MBO
5787	MBO supports employee career growth and advancement.	Management By Objectives	MBO
5788	MBO objectives drive performance excellence and innovation.	Management By Objectives	MBO
5789	MBO enhances organizational alignment and effectiveness.	Management By Objectives	MBO
5790	MBO fosters a culture of continuous learning and improvement.	Management By Objectives	MBO
5791	MBO aligns individual and team goals with company vision and values.	Management By Objectives	MBO
5792	MBO outcomes are tied to employee performance evaluations and rewards.	Management By Objectives	MBO
5793	Management By Objectives strengthens leadership and decision-making skills.	Management By Objectives	MBO
5794	MBO supports employee engagement and satisfaction.	Management By Objectives	MBO
5795	MBO goals should be aligned with departmental and organizational objectives.	Management By Objectives	MBO
5796	MBO promotes goal alignment with company culture and values.	Management By Objectives	MBO
5797	MBO measures goal achievement and progress toward strategic goals.	Management By Objectives	MBO
5798	MBO supports employee skill development and growth.	Management By Objectives	MBO
5799	MBO objectives enhance leadership development and talent management.	Management By Objectives	MBO
5800	MBO fosters a culture of accountability, excellence, and achievement.	Management By Objectives	MBO
5801	Performance Management is essential for organizational success.	Performance Management	PM
5802	PM involves setting clear performance expectations.	Performance Management	PM
5803	Effective PM enhances employee motivation.	Performance Management	PM
5804	PM aligns individual goals with company objectives.	Performance Management	PM
5805	Managers play a crucial role in PM.	Performance Management	PM
5806	PM supports employee development.	Performance Management	PM
5807	Regular feedback is part of PM.	Performance Management	PM
5808	PM focuses on employee growth.	Performance Management	PM
5809	PM promotes a culture of excellence.	Performance Management	PM
5810	Performance Management drives organizational performance.	Performance Management	PM
5811	PM ensures employees understand their roles.	Performance Management	PM
5812	PM fosters a results-oriented culture.	Performance Management	PM
5813	Managers provide guidance in PM.	Performance Management	PM
5814	PM enhances communication within teams.	Performance Management	PM
5815	PM encourages continuous improvement.	Performance Management	PM
5816	PM measures individual and team contributions.	Performance Management	PM
5817	Clear objectives are part of PM.	Performance Management	PM
5818	PM supports employee recognition programs.	Performance Management	PM
5819	PM promotes accountability.	Performance Management	PM
5820	PM evaluates employee achievements.	Performance Management	PM
5821	PM enhances decision-making processes.	Performance Management	PM
5822	PM drives employee engagement.	Performance Management	PM
5823	Performance Management aligns teams with strategic goals.	Performance Management	PM
5824	PM involves regular performance evaluations.	Performance Management	PM
5825	PM measures progress toward goals.	Performance Management	PM
5826	PM supports career development.	Performance Management	PM
5827	PM fosters collaboration among employees.	Performance Management	PM
5828	PM enhances organizational effectiveness.	Performance Management	PM
5829	PM ensures fair performance evaluations.	Performance Management	PM
5830	PM promotes a culture of learning.	Performance Management	PM
5831	PM encourages goal setting.	Performance Management	PM
5832	PM aligns employees with company values.	Performance Management	PM
5833	PM measures productivity and efficiency.	Performance Management	PM
5834	PM supports talent development.	Performance Management	PM
5835	PM fosters a positive work environment.	Performance Management	PM
5836	PM evaluates employee competencies.	Performance Management	PM
5837	PM drives employee satisfaction.	Performance Management	PM
5838	PM aligns personal goals with company mission.	Performance Management	PM
5839	PM ensures fair compensation.	Performance Management	PM
5840	PM promotes teamwork.	Performance Management	PM
5841	PM enhances employee morale.	Performance Management	PM
5842	PM supports individual growth.	Performance Management	PM
5843	PM measures job performance.	Performance Management	PM
5844	PM fosters a culture of innovation.	Performance Management	PM
5845	PM aligns with organizational goals.	Performance Management	PM
5846	PM supports employee empowerment.	Performance Management	PM
5847	PM evaluates skills and abilities.	Performance Management	PM
5848	PM enhances organizational culture.	Performance Management	PM
5849	PM promotes employee well-being.	Performance Management	PM
5850	PM measures achievement of key performance indicators.	Performance Management	PM
5851	PM aligns employees with company strategy.	Performance Management	PM
5852	PM supports employee skill enhancement.	Performance Management	PM
5853	PM fosters a culture of accountability.	Performance Management	PM
5854	PM measures outcomes and results.	Performance Management	PM
5855	PM supports professional development.	Performance Management	PM
5856	PM enhances employee loyalty.	Performance Management	PM
5857	PM evaluates employee potential.	Performance Management	PM
5858	PM promotes goal alignment.	Performance Management	PM
5859	PM aligns employees with industry standards.	Performance Management	PM
5860	PM supports employee recognition initiatives.	Performance Management	PM
5861	PM measures job satisfaction.	Performance Management	PM
5862	PM ensures performance consistency.	Performance Management	PM
5863	PM fosters a culture of excellence and quality.	Performance Management	PM
5864	PM aligns individual goals with team objectives.	Performance Management	PM
5865	PM evaluates employee commitment.	Performance Management	PM
5866	PM promotes collaboration and cooperation.	Performance Management	PM
5867	PM measures employee engagement levels.	Performance Management	PM
5868	PM supports skill development programs.	Performance Management	PM
5869	PM enhances leadership capabilities.	Performance Management	PM
5870	PM aligns employees with market demands.	Performance Management	PM
5871	PM fosters a culture of trust and respect.	Performance Management	PM
5872	PM measures employee motivation.	Performance Management	PM
5873	PM supports continuous learning initiatives.	Performance Management	PM
5874	PM evaluates team dynamics.	Performance Management	PM
5875	PM promotes a positive workplace culture.	Performance Management	PM
5876	PM aligns employees with customer expectations.	Performance Management	PM
5877	PM fosters a culture of achievement.	Performance Management	PM
5878	PM measures employee adaptability.	Performance Management	PM
5879	PM ensures consistent job performance.	Performance Management	PM
5880	PM supports employee recognition ceremonies.	Performance Management	PM
5881	PM aligns employees with company priorities.	Performance Management	PM
5882	PM fosters a culture of creativity.	Performance Management	PM
